{
  "input_fg": "https://hips.hearstapps.com/hmg-prod/images/scarlett-johansson-attends-the-premiere-of-illuminations-news-photo-1639390369.jpg",
  "prompt": "beautiful woman, detailed face, neon light, city",
  "width": 512,
  "height": 768,
  "seed": 14,
  "steps": 25,
  "a_prompt": "best quality",
  "n_prompt": "lowres, bad anatomy, bad hands, cropped, worst quality",
  "cfg": 2,
  "highres_scale": 1.5,
  "highres_denoise": 0.5,
  "lowres_denoise": 0.9,
  "bg_source": "BOTTOM"
}